{
  "schema": "virgil.session-status.v1",
  "reportedAt": "2026-09-11T17:19:58Z",
  "aboutCommit": "2a18c8ef3414f8d3b96cf7fa71f1d9989f0fee04",
  "branch": "claude/virgil-checks-and-records",
  "candidate": null,
  "holder": "fabricator",
  "hops": [
    {
      "role": "fabricator",
      "activity": "WORKING",
      "reported": null,
      "at": "2026-09-11T17:19:58Z"
    },
    {
      "role": "prover",
      "activity": "READY",
      "reported": null,
      "at": null
    },
    {
      "role": "keeper",
      "activity": "REPORTED",
      "reported": "BLOCKED",
      "at": "2026-09-11T17:19:58Z"
    }
  ],
  "review": null,
  "note": "The system audit ran; its worst finding is repaired and two need the owner."
}
